Text,Image
The quick brown fox jump over the lazy dog.,SentencePictures\Sentence_001.jpg
Pack my box with five dozen liquor jugs.,SentencePictures\Sentence_002.jpg
How vexingly quick daft zebras jump.,SentencePictures\Sentence_003.jpg
Jaded zombies acted with a quaint fury.,SentencePictures\Sentence_004.jpg
Cozy sphinxes moved with quiet jumps.,SentencePictures\Sentence_005.jpg
The five boxing wizards jump quickly.,SentencePictures\Sentence_006.jpg
The job requires a good knowledge of a variety of techniques.,SentencePictures\Sentence_007.jpg
My mind has been playing tricks on me all day.,SentencePictures\Sentence_008.jpg
This is a perfect example of a simple but effective design.,SentencePictures\Sentence_009.jpg
The only way to get a good night's sleep is to relax before bed.,SentencePictures\Sentence_010.jpg
"Sphinx of black quartz, judge my vow.",SentencePictures\Sentence_011.jpg
The wizard's quick jump saved the vexed dwarf.,SentencePictures\Sentence_012.jpg
Brightly colored kites flew high in the sky.,SentencePictures\Sentence_013.jpg
The antique clock chimed exactly on the hour.,SentencePictures\Sentence_014.jpg
A quiet evening at home is just what I needed.,SentencePictures\Sentence_015.jpg
She quietly practiced her piano every night.,SentencePictures\Sentence_016.jpg
Please pass me the salt and pepper shakers.,SentencePictures\Sentence_017.jpg
The beautiful sunset painted the sky in shades of orange.,SentencePictures\Sentence_018.jpg
He quickly gathered his belongings and left the room.,SentencePictures\Sentence_019.jpg
Can you recommend a good book to read?,SentencePictures\Sentence_020.jpg
The bustling market was filled with interesting sights and sounds.,SentencePictures\Sentence_021.jpg
I need to write a quick note before I forget.,SentencePictures\Sentence_022.jpg
Learning a new skill takes time and patience.,SentencePictures\Sentence_023.jpg
"The old bridge spanned the deep, winding river.",SentencePictures\Sentence_024.jpg
The five boxing wizards jump quickly.,SentencePictures\Sentence_025.jpg
Pack my box with five dozen liquor jugs.,SentencePictures\Sentence_026.jpg
"Go, lazy fat vixen; be shrewd, jump quick.",SentencePictures\Sentence_027.jpg
"When zombies arrive, quickly fax Judge Pat.",SentencePictures\Sentence_028.jpg
Amazingly few discotheques provide jukeboxes.,SentencePictures\Sentence_029.jpg
Puzzled women bequeath jerks very exotic gifts.,SentencePictures\Sentence_030.jpg
The quick onyx goblin jumps over the lazy dwarf.,SentencePictures\Sentence_031.jpg
Brawny gods just flocked up to quiz and vex him.,SentencePictures\Sentence_032.jpg
"Watch “Jeopardy!”, Alex Trebek's fun TV quiz game.",SentencePictures\Sentence_033.jpg
Six big devils from Japan quickly forgot how to waltz.,SentencePictures\Sentence_034.jpg
Five or six big jet planes zoomed quickly by the tower.,SentencePictures\Sentence_035.jpg
Jack amazed a few girls by dropping the antique onyx vase.,SentencePictures\Sentence_036.jpg
A quick movement of the enemy will jeopardize six gunboats.,SentencePictures\Sentence_037.jpg
Jaded zombies acted quaintly but kept driving their oxen forward.,SentencePictures\Sentence_038.jpg
Sixty zippers were quickly picked from the woven jute bag.,SentencePictures\Sentence_039.jpg
My girl wove six dozen plaid jackets before she quit.,SentencePictures\Sentence_040.jpg
Brown jars prevented the mixture from freezing too quickly.,SentencePictures\Sentence_041.jpg
We promptly judged antique ivory buckles for the next prize.,SentencePictures\Sentence_042.jpg
Farmer Jack realized that big yellow quilts were expensive.,SentencePictures\Sentence_043.jpg
Fake bugs put in wax jonquils drive him crazy.,SentencePictures\Sentence_044.jpg
Vamp fox held quartz duck just by the wing.,SentencePictures\Sentence_045.jpg
A wizard's job is to vex chumps quickly in fog.,SentencePictures\Sentence_046.jpg
"Waxy and quivering, jocks fumble the pizza.",SentencePictures\Sentence_047.jpg
Glib jocks quiz nymph to vex dwarf.,SentencePictures\Sentence_048.jpg
